{
  "contract_version": "1.0.0",
  "diversity": {
    "distinct_episode_ids": [
      "2026-07-31/v001"
    ],
    "distinct_thread_ids": [],
    "duplicate_groups_removed": 0
  },
  "episode_date": "2026-08-06",
  "limits": {
    "max_characters": 10000,
    "max_claims": 10,
    "max_episodes": 3,
    "max_lessons": 3,
    "max_threads": 5
  },
  "query_plan_path": "working/memory_query_plan_2026-08-06.json",
  "rejected": [],
  "selected": [
    {
      "episode_ids": [],
      "historical_confidence": "high",
      "item_id": "fox-editorial-state",
      "item_type": "core",
      "path": "editorial-memory/core/fox_editorial_state.md",
      "provenance_paths": [
        "editorial-memory/memory_policy.md"
      ],
      "reasons": [
        "always_include"
      ],
      "requires_current_revalidation": false,
      "score": 100,
      "status": "active",
      "use_mode": "procedural"
    },
    {
      "episode_ids": [
        "2026-07-31/v001"
      ],
      "historical_confidence": "medium",
      "item_id": "ai-capex-evaluation-axis",
      "item_type": "claim",
      "path": "editorial-memory/claim_ledger.json",
      "provenance_paths": [
        "editorial-memory/episodes/2026-07-31/revisions/v001/provenance.json"
      ],
      "reasons": [
        "exact_entity",
        "topic_match",
        "provenance_verified"
      ],
      "requires_current_revalidation": true,
      "score": 31,
      "status": "active",
      "use_mode": "current_revalidation_required"
    }
  ],
  "usage": {
    "characters": 1400,
    "claims": 1,
    "episodes": 0,
    "lessons": 0,
    "threads": 0
  },
  "warnings": []
}
